{
  "stampId": "ES-R24-A0-ATLAS-INCREMENTAL-EQUIVALENCE-FAULTS",
  "missionId": "YALKEN-R2.4-GUIDED-BOOTSTRAP-2026-08-19",
  "contourId": "A0_ATLAS_INCREMENTAL_EQUIVALENCE",
  "attemptId": "ATTEMPT-A0-20260823",
  "authorityEpoch": "R24-A0-ADMISSION-BASE-0BB87AE9",
  "profileId": "ATLAS_MAPS_DERIVED",
  "repo": {
    "canonicalPath": "/Volumes/T7-Secure/storage/yalken/canonical/writer-editor-codex",
    "originUrl": "https://github.com/KirPonomarev/writer-editor.git",
    "headSha": "160186513389b05f336f0dcf1c06135959627c09",
    "treeSha": "172ae3098fd2a51f2894a5dc9bf5aa0e95ff51a5"
  },
  "createdAt": "2026-08-23T11:06:52Z",
  "actor": "codex/r24-a0-closure-receipt-v1-20260823",
  "claim": {
    "type": "A0_FAULT_INJECTION_FAIL_CLOSED",
    "ceiling": "A0_ATLAS_INCREMENTAL_EQUIVALENCE_NODE_ONLY_NO_PROGRAM_DONE",
    "verdict": "PASS"
  },
  "test": {
    "oracleId": "runAtlasA0Proof.faults+compileAtlasA0Evidence.negative-fixtures",
    "denominator": 11,
    "passed": 11,
    "failed": 0,
    "skipped": 0,
    "exitCode": 0,
    "evidenceClass": "FAULT_INJECTION"
  },
  "causal": {
    "parentStampIds": [
      "ES-R24-A0-ATLAS-INCREMENTAL-EQUIVALENCE-INTEGRATION"
    ],
    "predecessorReceiptDigest": "b3c931e011d745f346a83914311204abc1b0a63d86dce501cb9fda0b716056ce"
  },
  "artifact": {
    "faultCodes": [
      "E_ATLAS_GLOBAL_COMPOSITE_STALE_RESULT",
      "E_ATLAS_GLOBAL_COMPOSITE_STALE_RESULT",
      "E_ATLAS_GLOBAL_COMPOSITE_RESULT_FAILED",
      "E_ATLAS_GLOBAL_COMPOSITE_HASH_MISMATCH",
      "E_CAPABILITY_DISABLED_FOR_COMMAND",
      "E_R24_A0_EXACT_HEAD_MISMATCH",
      "E_R24_A0_WORKTREE_DIRTY",
      "E_R24_A0_WORKFLOW_ORDER",
      "E_R24_A0_REQUIRED_EVIDENCE_MISSING",
      "E_R24_A0_OVERCLAIM",
      "E_R24_A0_RESOURCE_BUDGET_UNPROVEN"
    ],
    "artifactDigests": [
      {
        "path": "scripts/ops/r24/atlas-incremental-equivalence-a0.mjs",
        "sha256": "1be34ff9ca768465ed57815174ba6e55efbe664fc26c9b7a407c922387f3302f"
      },
      {
        "path": "test/unit/r24-a0-atlas-incremental-equivalence.test.js",
        "sha256": "5db893ee6c0788b2d573f77d552c64399ec1efebbac4b328b14325948ad49637"
      },
      {
        "path": "test/unit/r24-a0-atlas-physics.test.js",
        "sha256": "ea7b8b0427a386ac5529dd91329993f8263f8fe4c24691755158ea0619467c4e"
      }
    ]
  },
  "schemaVersion": "EvidenceStampV2"
}
