{
  "schemaVersion": "EvidenceStampV2",
  "missionId": "YALKEN-R2.4-GUIDED-BOOTSTRAP-2026-08-19",
  "contourId": "V0_WRITER_CLAIM_COMPILER",
  "attemptId": "ATTEMPT-V0-20260824",
  "authorityEpoch": "R24-V0-CERTIFICATION-BASE-F1365F72",
  "profileId": "WRITER_TRUTH_FOUNDATION",
  "repo": {
    "canonicalPath": "/Volumes/T7-Secure/storage/yalken/canonical/writer-editor-codex",
    "originUrl": "https://github.com/KirPonomarev/writer-editor.git",
    "headSha": "77de410bc7400d29a11d6fc90b9e6b297611fe18",
    "treeSha": "55ff93e86b215ddad92a6fa21a9d009779435395"
  },
  "createdAt": "2026-08-24T10:19:32Z",
  "actor": "codex/r24-v0-writer-claim-certification-v1-20260824",
  "stampId": "ES-R24-V0-WRITER-CLAIM-COMPILER-CONTRACT",
  "claim": {
    "type": "V0_WRITER_CLAIM_FAIL_CLOSED_CONTRACT",
    "ceiling": "V0_NODE_ONLY_EXACT_F0_DEPENDENCY_DNA_ARTIFACT_PROFILE_AND_OVERCLAIM_CONTRACT_NO_RELEASE_NO_PROGRAM_DONE",
    "verdict": "PASS"
  },
  "test": {
    "oracleId": "r24-v0-writer-claim-compiler-contract",
    "evidenceClass": "CONTRACT",
    "denominator": 8,
    "passed": 8,
    "failed": 0,
    "skipped": 0,
    "exitCode": 0
  },
  "causal": {
    "parentStampIds": [
      "ES-R24-V0-WRITER-CLAIM-COMPILER-MODEL"
    ],
    "predecessorReceiptDigest": "8ad402d8df8ffd577a5983d348579292dfb5b2427af8aaf2c237bd085cbab065"
  },
  "artifact": {
    "command": "npm run test:r24-v0",
    "tests": {
      "pass": 9,
      "fail": 0,
      "skipped": 0,
      "todo": 0
    },
    "contractTests": 8,
    "mutantHarnessTests": 1,
    "requiredWriterStageCount": 22,
    "globalScalarPassForbidden": true,
    "optionalProfilesExcluded": [
      "ATLAS_MAPS_DERIVED",
      "WORD_ROUNDTRIP",
      "PACKAGED_RELEASE_SECURITY"
    ],
    "f0ArtifactDigestParticipatesInGateEvidenceDigest": true,
    "executableProgramSha256": "7185d649974289e8b3a0b310203b32dbd0bac96a613adf3cf26b308ff0067df5",
    "existingCompilerImplementationSourceSha": "f6e92ab57829e44a7aa360893acbb4952b3b2fbe",
    "certificationSourceSha": "77de410bc7400d29a11d6fc90b9e6b297611fe18",
    "evaluationHeadSha": "77de410bc7400d29a11d6fc90b9e6b297611fe18",
    "evaluationTreeSha": "55ff93e86b215ddad92a6fa21a9d009779435395",
    "prHeadSha": null,
    "mergeSha": null,
    "postmergeSha": null
  }
}
