{
  "schemaVersion": "EvidenceStampV2",
  "missionId": "YALKEN-R2.4-GUIDED-BOOTSTRAP-2026-08-19",
  "contourId": "R2_STORAGE_BAKEOFF",
  "attemptId": "ATTEMPT-R2-20260824",
  "authorityEpoch": "R24-R2-CERTIFICATION-BASE-20240143",
  "profileId": "WRITER_TRUTH_FOUNDATION",
  "repo": {
    "canonicalPath": "/Volumes/T7-Secure/storage/yalken/canonical/writer-editor-codex",
    "originUrl": "https://github.com/KirPonomarev/writer-editor.git",
    "headSha": "202401430ae4ac6428b0a262cadaf6bb8408614f",
    "treeSha": "eb5b74035a8a281e7336a1a1fc6685b6cd8564a1"
  },
  "createdAt": "2026-08-23T23:52:00Z",
  "actor": "codex/r24-r2-storage-certification-v1-20260824",
  "stampId": "ES-R24-R2-STORAGE-BAKEOFF-POSTMERGE-EXACT-HEAD",
  "claim": {
    "type": "R2_CURRENT_MAIN_EXACT_HEAD_CI",
    "ceiling": "R2_NODE_ONLY_NO_STORAGE_ADOPTION_NO_PROGRAM_DONE",
    "verdict": "PASS"
  },
  "test": {
    "oracleId": "r24-r2-postmerge-exact-head",
    "evidenceClass": "POSTMERGE",
    "denominator": 2,
    "passed": 2,
    "failed": 0,
    "skipped": 0,
    "exitCode": 0
  },
  "causal": {
    "parentStampIds": [
      "ES-R24-R2-STORAGE-BAKEOFF-EXACT-HEAD"
    ],
    "predecessorReceiptDigest": "5d7077d53940fefc25567f9ea9fdbc5843f35517a4cd01139502450bf12dd4f4"
  },
  "artifact": {
    "mainExactHeadChecks": [
      {
        "workflowName": "rtk-required",
        "runId": 32673721394,
        "jobId": 97278372366,
        "event": "push",
        "headSha": "202401430ae4ac6428b0a262cadaf6bb8408614f",
        "conclusion": "success",
        "completedAt": "2026-08-23T23:49:18Z",
        "includedR2Gate": true
      },
      {
        "workflowName": "OSS policy",
        "runId": 32673721492,
        "jobId": 97278372980,
        "event": "push",
        "headSha": "202401430ae4ac6428b0a262cadaf6bb8408614f",
        "conclusion": "success",
        "completedAt": "2026-08-23T23:29:07Z"
      }
    ],
    "nonClaims": [
      "Current-main CI certifies R2 evidence only.",
      "It does not select or adopt a storage candidate."
    ]
  }
}
