{
  "schemaVersion": "EvidenceStampV2",
  "missionId": "YALKEN-R2.4-GUIDED-BOOTSTRAP-2026-08-19",
  "contourId": "R5_LIFECYCLE_EXTERNAL_CONFLICT",
  "attemptId": "ATTEMPT-R5-20260824",
  "authorityEpoch": "R24-R5-CORRECTIVE-BASE-8454B33D",
  "profileId": "WRITER_TRUTH_FOUNDATION",
  "repo": {
    "canonicalPath": "/Volumes/T7-Secure/storage/yalken/canonical/writer-editor-codex",
    "originUrl": "https://github.com/KirPonomarev/writer-editor.git",
    "headSha": "1012a28bcd74847898e380812d51c81ebd3a5dc1",
    "treeSha": "ea65acde08a418a32f0bd1da56a598565cc618fb"
  },
  "createdAt": "2026-08-24T04:12:13Z",
  "actor": "codex/r24-r5-lifecycle-external-conflict-certification-v1-20260824",
  "stampId": "ES-R24-R5-LIFECYCLE-EXTERNAL-CONFLICT-CONTRACT",
  "claim": {
    "type": "R5_ACCEPTANCE_CONTRACT_CORRECTIVE_PROFILE",
    "ceiling": "R5_NODE_ONLY_CORRECTED_LIFECYCLE_CONFLICT_PROTOCOL_WITH_PRODUCTION_CLOSE_QUIT_GENERATION_FENCE_NO_PLATFORM_SUSPEND_WIRING_NO_EXTERNAL_FILE_WATCHER_NO_RECOVERY_UI_NO_PROGRAM_DONE",
    "verdict": "PASS"
  },
  "test": {
    "oracleId": "r24-r5-contract",
    "evidenceClass": "CONTRACT",
    "denominator": 16,
    "passed": 16,
    "failed": 0,
    "skipped": 0,
    "exitCode": 0
  },
  "causal": {
    "parentStampIds": [
      "ES-R24-R5-LIFECYCLE-EXTERNAL-CONFLICT-MODEL"
    ],
    "predecessorReceiptDigest": "2c800aec20efa8fdc949673d663ae33e517501d43bffbb85da5c0e76be97924e"
  },
  "artifact": {
    "envelopeId": "ENV-R24-R5_LIFECYCLE_EXTERNAL_CONFLICT",
    "acceptanceId": "ACC-R24-R5_LIFECYCLE_EXTERNAL_CONFLICT",
    "requiredOutcome": "Handle quit, suspend, crash, external edits and divergence with typed barriers and recovery choices within the declared core protocol and attached close/quit profile.",
    "mutationAuthority": "LIFECYCLE_BARRIER_AND_CONFLICT_PROTOCOL",
    "materiality": [
      "DEFECT_FIXED_WITH_REGRESSION",
      "INVARIANT_NEWLY_ENFORCED",
      "NAMED_IMPLEMENTATION_MUTANTS_KILLED"
    ],
    "finding": "The admitted implementation could authorize stale or wrong-subject lifecycle progress, erase a newer edit generation after save, and open a close TOCTOU after approval.",
    "correctedProfile": "CORE_LIFECYCLE_CONFLICT_PROTOCOL_PLUS_PRODUCTION_CLOSE_QUIT_EXACT_GENERATION_REVALIDATION",
    "testProfileDisposition": {
      "CONTRACT_NEGATIVE": "PASS",
      "UNIT": "PASS",
      "INTEGRATION": "PASS",
      "IMPLEMENTATION_MUTANTS": "PASS_11_OF_11",
      "UNICODE_IME": "UNICODE_DIGEST_PATH_PASS_IME_NOT_APPLICABLE_NO_NEW_UI_SURFACE",
      "CRASH_RECOVERY": "PASS_FRESH_R4_AND_P3_PHYSICAL_CLASSIFICATION",
      "A11Y_PERF": "A11Y_NOT_APPLICABLE_NO_NEW_UI; LINEAR_20K_EFFECT_DENOMINATOR_PASS"
    },
    "forbidden": [
      "FALSE_PLATFORM_SUSPEND_CLAIM",
      "FALSE_EXTERNAL_WATCHER_CLAIM",
      "FALSE_RECOVERY_UI_CLAIM",
      "CROSS_PROCESS_SERIALIZATION_CLAIM",
      "USER_DOCUMENT_MUTATION",
      "DEPENDENCY_ADOPTION",
      "SAFE_APPLY_EXPANSION",
      "NETWORK_OR_CLOUD_AUTHORITY",
      "PROGRAM_DONE"
    ],
    "residualRisks": [
      "The production composition root applies the corrected barrier to BrowserWindow close and app before-quit; platform suspend is not wired in this contour.",
      "External-edit and crash decisions require exact caller-supplied disk, R4 and P3 observations; no production external file watcher or recovery UI is attached here.",
      "The close path uses a detached zero-effect observation because the optional R4 inbox/outbox is not attached to the production composition root.",
      "A successful file write whose later profile or shell-state persistence fails is not promoted to a SAVED acknowledgement by this contour.",
      "The lifecycle protocol is process-local and does not claim cross-process or cross-host conflict serialization.",
      "No user document, storage format, dependency, SAFE_APPLY, release, signing, cloud or AI authority is added."
    ]
  }
}
