{
  "missionId": "YALKEN-R2.4-GUIDED-BOOTSTRAP-2026-08-19",
  "contourId": "WP-503_ATLAS_SURFACE",
  "attemptId": "ATTEMPT-WP503-20260901",
  "authorityEpoch": "YALKEN_R24_MAIN_PRODUCT_WP503_AUTHORITY_EPOCH_V2",
  "profileId": "ATLAS_PRODUCT_V34",
  "repo": {
    "canonicalPath": "/Volumes/T7-Secure/storage/yalken/canonical/writer-editor-codex",
    "originUrl": "https://github.com/KirPonomarev/writer-editor.git",
    "headSha": "3157d84126a76734af50d012b359f7a58b2035fb",
    "treeSha": "7f38243ced17ee249f0c541004171235a1e14788"
  },
  "createdAt": "2026-09-01T13:57:42.010Z",
  "actor": "codex/r24-wp503-atlas-surface-v1-20260901",
  "schemaVersion": "EvidenceStampV2",
  "stampId": "ES-R24-WP-503-ATLAS-SURFACE-SURVIVOR-AUDIT",
  "claim": {
    "type": "WP503_POSTMERGE_SURVIVOR_PREDICATE_DECLARATION",
    "ceiling": "WP503_PREDICATE_DECLARATION_ONLY_FUTURE_EXTERNAL_IDENTITY_NOT_PRECLAIMED",
    "verdict": "PASS"
  },
  "test": {
    "oracleId": "SINGLE_TERMINAL_PR_POSTMERGE_SURVIVOR_PREDICATE",
    "evidenceClass": "CONTRACT",
    "denominator": 1,
    "passed": 1,
    "failed": 0,
    "skipped": 0,
    "exitCode": 0
  },
  "causal": {
    "predecessorReceiptDigest": "9a5b58d2b29336508090d8a5f9e02ee61e4b6e22d7ba5ea137f6b45a7901a687",
    "parentStampIds": [
      "ES-R24-WP-503-ATLAS-SURFACE-EXACT-HEAD"
    ]
  },
  "artifact": {
    "mergeSha": null,
    "opsVectorCloseRunId": null,
    "postmergeCiRunId": null,
    "protectedWipBeforeDigest": "680246f35b65f98ef17ce823d90b0e982a01528dc21fd64de0cba94e9c87095e",
    "protectedWipAfterDigest": "95735ffa221cad9d112027d4db1d3879909ba7e0a6a4ac8989b79a8eda0d4f8d",
    "protectedWipExact": true,
    "pendingReason": "PROTECTED_MERGE_OPS_VECTOR_CLOSE_AND_POSTMERGE_CI_ARE_FUTURE_EXTERNAL_IDENTITIES",
    "sourcePlanRoles": {
      "externalSourcePlanDigest": "1f5b5b7b63a9f7806db1ecbcd8fa5f16484a73df3fe51f9a5d699d52f4c3fb9a",
      "compiledProgramFileDigest": "da754a8a0e2c09014f342b908502e83ab975488ab665feb2a8a66d0b0d46ae0a",
      "rolesDistinct": true
    }
  }
}
