{
  "stampId": "ES-R24-WP-501-TIME-KNOWLEDGE-MUTANTS",
  "missionId": "YALKEN-R2.4-GUIDED-BOOTSTRAP-2026-08-19",
  "contourId": "WP-501_TIME_KNOWLEDGE",
  "attemptId": "ATTEMPT-WP501-20260901",
  "authorityEpoch": "YALKEN_R24_MAIN_PRODUCT_WP501_AUTHORITY_EPOCH_V1",
  "profileId": "ATLAS_PRODUCT_V33",
  "repo": {
    "canonicalPath": "/Volumes/T7-Secure/storage/yalken/canonical/writer-editor-codex",
    "originUrl": "https://github.com/KirPonomarev/writer-editor.git",
    "headSha": "810603c97958a7e94c9a537ab3e6f5a834d6502d",
    "treeSha": "ae74bd0ff5b587493032f640b8bacb2f65cf452a"
  },
  "claim": {
    "type": "WP501_IMPLEMENTATION_MUTATION_ORACLE",
    "ceiling": "WP501_NODE_TRIPLE_TIME_AND_EVIDENCE_BOUND_PERSPECTIVE_KNOWLEDGE_ONLY_EXACT_WP500_PREDECESSOR_NO_PERSISTENCE_NO_RENDERER_NO_COMMAND_NO_PLATFORM_EFFECT_NO_NEXT_NODE_NO_PROGRAM_DONE",
    "verdict": "PASS"
  },
  "test": {
    "oracleId": "WP501_IMPLEMENTATION_MUTATION_ORACLE",
    "evidenceClass": "IMPLEMENTATION_MUTANTS",
    "denominator": 9,
    "passed": 9,
    "failed": 0,
    "skipped": 0,
    "exitCode": 0
  },
  "causal": {
    "parentStampIds": [
      "ES-R24-WP-501-TIME-KNOWLEDGE-INTEGRATION"
    ],
    "predecessorReceiptDigest": "17d2998d20041005cfa01ef2745599854b20ed9fe28f5ad40dfe590225c19978"
  },
  "createdAt": "2026-09-01T07:43:59Z",
  "actor": "codex/r24-wp501-time-knowledge-v1-20260901",
  "artifact": {
    "command": "node --test r24-wp501-time-knowledge-mutants.test.js",
    "mutantsKilled": 9,
    "mutantsSurvived": 0,
    "mutantIds": [
      "narrative-scene-order-mismatch-admitted",
      "unknown-ordinal-admitted",
      "multi-scene-evidence-admitted",
      "scope-leak-admitted",
      "unused-evidence-admitted",
      "semantic-duplicate-admitted",
      "product-mutation-authority-leaked",
      "projection-rebuild-mismatch-admitted",
      "query-result-tamper-admitted"
    ],
    "sourcePlanRoles": {
      "externalSourcePlanDigest": "1f5b5b7b63a9f7806db1ecbcd8fa5f16484a73df3fe51f9a5d699d52f4c3fb9a",
      "compiledProgramFileDigest": "da754a8a0e2c09014f342b908502e83ab975488ab665feb2a8a66d0b0d46ae0a",
      "rolesDistinct": true
    }
  },
  "schemaVersion": "EvidenceStampV2"
}
