{"schemaVersion":"EvidenceStampV2","stampId":"ES-R24-WP-507-ATLAS-PRODUCT-CLAIM-CONTRACT","missionId":"YALKEN-R2.4-GUIDED-BOOTSTRAP-2026-08-19","contourId":"WP-507_ATLAS_PRODUCT_CLAIM","attemptId":"ATTEMPT-WP507-SUCCESSOR-20260902","authorityEpoch":"YALKEN_R24_MAIN_PRODUCT_WP507_SUCCESSOR_AUTHORITY_EPOCH_V2","profileId":"ATLAS_PRODUCT_V33","repo":{"canonicalPath":"/Volumes/T7-Secure/storage/yalken/canonical/writer-editor-codex","originUrl":"https://github.com/KirPonomarev/writer-editor.git","headSha":"99e7cd23862796256a69ef38c4e4f987d57f12aa","treeSha":"8faf35f0a7bec3efc6446405141ee02d139b8a94"},"claim":{"type":"WP507_ATLAS_PRODUCT_CLAIM_ACCEPTANCE_CONTRACT","ceiling":"WP507_NODE_AND_ATLAS_PRODUCT_V33_PROFILE_ONLY","verdict":"PASS"},"test":{"oracleId":"node --test r24-wp507-atlas-product-claim.test.js","evidenceClass":"CONTRACT","denominator":6,"passed":6,"failed":0,"skipped":0,"exitCode":0},"causal":{"parentStampIds":["ES-R24-WP-507-ATLAS-PRODUCT-CLAIM-MODEL"],"predecessorReceiptDigest":"0b177b801ba0ec5a209f7fc05b3965aab88ccc0e524b517056946ee829f663ee"},"createdAt":"2026-09-02T11:25:00Z","actor":"codex/r24-wp507-atlas-product-claim-successor-v1-20260902","artifact":{"testArtifact":{"path":"test/unit/r24-wp507-atlas-product-claim.test.js","sha256":"6252db6fa30ec00d2f50d69379e97f56496e4ae7ae34534a82d994834dec6f3e"},"requiredBehaviors":["COMPLETE_NODE_AND_ASSURANCE_DENOMINATORS","STALE_FUTURE_TAMPER_REJECTION","OWNER_GATE_SCOPE_AND_MISSION","OVERCLAIM_REJECTION","STRICT_DATA_BOUNDARY","ABSOLUTE_AUTHORITY_EXCLUSIONS"],"sourcePlanRoles":{"externalSourcePlanDigest":"1f5b5b7b63a9f7806db1ecbcd8fa5f16484a73df3fe51f9a5d699d52f4c3fb9a","compiledProgramFileDigest":"da754a8a0e2c09014f342b908502e83ab975488ab665feb2a8a66d0b0d46ae0a","rolesDistinct":true}}}
